来源,时间,标题
财联社,2025-06-28 18:15:07.000,沪市公司2024年现金分红达1.8万亿 创历史新高
财联社,2025-06-28 18:13:52.000,业内称部分显卡租赁价格较年初高点“腰斩”
财联社,2025-06-28 18:12:59.000,全国首单“低空运营管理责任保险”落地苏州
财联社,2025-06-28 17:56:27.000,我国首个发电行业大模型“擎源”发布 模型参数达千亿级别
财联社,2025-06-28 17:54:48.000,浙江国际大宗商品交易中心成立
财联社,2025-06-28 17:42:34.000,首批23只浮费基金合计募集218亿元 下周再有两只新发
财联社,2025-06-28 17:41:43.000,特斯拉：全球超级充电桩数量突破7万根
财联社,2025-06-28 17:33:10.000,南极洲斯科舍海发生6.4级地震 震源深度10千米
财联社,2025-06-28 17:06:22.000,深交所副总经理李辉： 深交所正紧锣密鼓地谋划创业板改革
财联社,2025-06-28 17:00:39.000,上交所副总经理王泊：“并购六条”以来沪市披露各类资产重组方案676单 同比增长15%
财联社,2025-06-28 16:59:24.000,特朗普称加沙停火“接近”达成 多方加紧斡旋
财联社,2025-06-28 16:47:46.000,贵州从江县发布城区防洪Ⅰ级应急响应
财联社,2025-06-28 16:40:06.000,南方区域电力市场启动连续结算试运行
财联社,2025-06-28 16:27:51.000,巴基斯坦发生自杀式炸弹袭击 13名士兵死亡
财联社,2025-06-28 16:23:45.000,数字人民币“碰一碰”过闸试点扩围 今日扩至上海轨道交通全线网
财联社,2025-06-28 16:02:28.000,泽连斯基任命乌克兰新任武装力量联合部队司令
财联社,2025-06-28 15:51:14.000,哈梅内伊高级顾问现身国葬现场 曾被传身亡
财联社,2025-06-28 15:44:23.000,中国金茂一日内落子三城：斥资约51.44亿元收获三宗地块
财联社,2025-06-28 15:42:19.000,雷军：小米YU7标准版实测综合续航784km
财联社,2025-06-28 15:29:42.000,国调基金召开2024年度股东会、董事会
财联社,2025-06-28 15:01:52.000,热浪席卷法国 多地最高气温逼近40摄氏度
财联社,2025-06-28 14:52:39.000,温州市市长张文杰：加快做大做强资本市场“温州板块” 更好赋能民营经济发展
财联社,2025-06-28 14:49:02.000,上海发布高温橙色预警
财联社,2025-06-28 14:47:38.000,普京：俄罗斯被“北约不东扩”承诺欺骗了
财联社,2025-06-28 14:44:27.000,以军扩大加沙军事行动规模 24小时内超200名巴勒斯坦人死伤
财联社,2025-06-28 14:41:46.000,我国建成首个干法后处理科研样机集成台架
财联社,2025-06-28 14:24:26.000,乌称俄袭击敖德萨市致2死 俄方暂无回应
财联社,2025-06-28 14:20:55.000,日美展开第七轮部长级关税谈判
财联社,2025-06-28 14:18:33.000,5名希腊政府高官因欧盟资金管理丑闻辞职
财联社,2025-06-28 14:10:54.000,2024年我国医疗器械工业市场规模达1.2万亿元
财联社,2025-06-28 13:59:47.000,落实水资源刚性约束制度 水利部等部门发布管理办法
财联社,2025-06-28 13:31:43.000,以军称拦截也门方向发射导弹 胡塞武装称将继续袭击以色列
财联社,2025-06-28 13:14:42.000,以伊冲突中 9名伊朗媒体工作者因以军袭击丧生
财联社,2025-06-28 12:56:26.000,贵州榕江县防汛应急响应提升至Ⅰ级
财联社,2025-06-28 12:51:02.000,以军称一导弹自也门方向来袭 以南部多地拉响防空警报
财联社,2025-06-28 12:39:52.000,伊朗为以伊冲突中遇难的高级指挥官和科学家举行葬礼
财联社,2025-06-28 12:36:54.000,全球首艘纯氨燃料内燃机动力示范船“氨晖号”首航成功
财联社,2025-06-28 12:31:19.000,云南贵州广西海南等地13条河流发生超警以上洪水
财联社,2025-06-28 11:58:53.000,德国要求苹果与谷歌下架DeepSeek应用 中方已多次明确表态
财联社,2025-06-28 11:47:46.000,交通运输部对防范应对强降雨天气再强调再部署再落实
财联社,2025-06-28 11:32:11.000,中国东方航空集团有限公司原党组书记刘绍勇接受审查调查
财联社,2025-06-28 11:23:16.000,伊朗外长谴责特朗普对哈梅内伊不敬
财联社,2025-06-28 11:13:45.000,黎巴嫩南部遭以色列猛烈空袭
财联社,2025-06-28 11:01:47.000,蓝色预警生效中 周末14省区有大到暴雨
财联社,2025-06-28 10:30:16.000,上海数据交易所加快建设一体化数据市场 上半年交易额超过30亿元
财联社,2025-06-28 10:14:51.000,1492家沪市公司披露提质增效重回报方案 主板覆盖率达56%
财联社,2025-06-28 10:11:30.000,贵州榕江县启动防汛Ⅱ级应急响应
财联社,2025-06-28 10:08:36.000,联合国官员：有必要延长联黎部队任务授权
财联社,2025-06-28 10:07:27.000,戴尔CEO减持套现12亿美元
财联社,2025-06-28 10:06:47.000,河南省348个重大项目集中开工 总投资2273.2亿元
同花顺,2025-06-28 10:03:55.000,云深处融资总监陈贞豪：公司今年出货量比往年高很多，B端市场未来可达几百亿
同花顺,2025-06-28 09:35:25.000,伊外长：伊朗与“投降”一词毫无关联
同花顺,2025-06-28 09:31:27.000,比亚迪叫停“价格战”！7月1日起，全国范围取消限时“一口价”政策
同花顺,2025-06-28 09:24:39.000,我国将迎新一轮强降雨 部分河流可能发生超警洪水
同花顺,2025-06-28 09:18:53.000,美媒：美国虚拟驻伊朗大使馆发布公告，坚持敦促在伊美国公民立即撤离
同花顺,2025-06-28 08:31:43.000,法国宣布扩大公共场所禁烟范围，涵盖海滩等室外区域
同花顺,2025-06-28 07:54:46.000,以色列无人机曾借道阿塞拜疆袭击伊朗？伊朗总统要求彻查，阿方驳斥有关指控
同花顺,2025-06-28 07:43:23.000,国产支线客机C909商业运营九周年 运送旅客超2400万人次
同花顺,2025-06-28 07:27:40.000,雷军晒小米YU7易车榜SUV续航榜第1：实测综合续航784km
同花顺,2025-06-28 06:58:05.000,全国政协常委周汉民：应鼓励科技型上市公司牵头或参与国家科技攻关任务、重大创新平台建设
同花顺,2025-06-28 06:52:06.000,全国政协常委周汉民：上市公司是推动科技成果向现实生产力转化的关键
同花顺,2025-06-28 06:45:18.000,上海发布高温橙色预警信号
同花顺,2025-06-28 06:22:45.000,星源材质东盟基地——马来西亚工厂（一期）项目建成
同花顺,2025-06-28 06:17:24.000,上海交通大学医学人工智能研究院成立，范先群担任院长
同花顺,2025-06-28 06:09:00.000,俄罗斯一轻型飞机坠毁，飞行员遇难
同花顺,2025-06-28 05:32:25.000,腾讯与泰康保险集团达成新一轮全面战略合作
同花顺,2025-06-28 05:13:59.000,以色列称拦截一枚来自也门的导弹
同花顺,2025-06-28 04:50:32.000,南都电源斩获海外1.4GWh储能大单
同花顺,2025-06-28 04:23:16.000,美媒：美军空袭5天后，伊朗福尔道核设施附近现施工迹象
同花顺,2025-06-28 04:14:43.000,隆基启动印尼组件制造工厂项目
同花顺,2025-06-28 03:32:49.000,中国东方航空集团原党组书记刘绍勇接受审查调查
同花顺,2025-06-28 03:25:22.000,洽洽食品：公司葵花籽原料与上一采购季采购价格相比有提升
同花顺,2025-06-28 03:13:23.000,比亚迪对印度大巴订单设严苛付款条件？消息人士：不实
同花顺,2025-06-28 02:56:20.000,徐工XE215EV电挖批量交付新能源企业
同花顺,2025-06-28 02:43:45.000,湖高新集团光谷环保中标新材料行业VOCs回收治理设备采购项目
同花顺,2025-06-28 01:58:33.000,今日25年飞天茅台原箱批价报1920元/瓶 较前一日上涨50元
同花顺,2025-06-28 01:44:36.000,小米YU7爆火催生倒卖订单：交付时间最长56周，有黄牛加价1.7万转卖
同花顺,2025-06-28 01:22:47.000,紫光展锐启动IPO辅导
同花顺,2025-06-28 01:21:57.000,中交集团闪电换帅：宋海良重返“老东家”掌舵
同花顺,2025-06-28 01:05:16.000,下周68股面临解禁
同花顺,2025-06-28 00:58:13.000,尹锡悦到案接受调查
同花顺,2025-06-28 00:39:36.000,铁路部门试点开展“轻装行”服务
新浪财经,2025-06-27 20:17:00.000,对话青科创联副秘书长薛健：产学研“双向奔赴”破解转化困局，推动具身智能落地转化
新浪财经,2025-06-27 20:11:00.000,对话西安交大兰旭光：具身智能研修会破解科技落地难题，中国数据优势引领产业突围
新浪财经,2025-06-27 19:36:00.000,立讯精密隐秘资本网浮现？有无代持套利局
新浪财经,2025-06-27 19:34:00.000,信濠光电无实控人认定是否存疑？四大董事席位人员疑均与立讯精密产生交织
新浪财经,2025-06-27 18:11:00.000,商米科技转战港股：自称“全球最大安卓端BIoT提供商” “卖设备”收入占比超98% 九成产品依赖代工
财新网,2025-06-27 12:30:00.000,夜读深度：小米的第二款车
财新网,2025-06-27 09:20:00.000,分析人士：通胀和赤字可能导致美债收益率再度上升
财新网,2025-06-27 08:30:00.000,光伏出口能否打开新局面
财新网,2025-06-27 07:30:00.000,数据推荐：公募总规模再创新高
财新网,2025-06-27 06:20:00.000,马斯克的心腹走人，有什么隐情？
财新网,2025-06-27 05:30:00.000,高盛眼里的A股大市和头部民企机会
财新网,2025-06-27 04:40:00.000,今日市场热点
财新网,2025-06-27 03:40:00.000,美国一季度GDP下修
财新网,2025-06-27 02:26:32.182,热点数据：前五月规上工业利润转降
财新网,2025-06-27 01:30:00.000,数据发现：日本5月出口额转降
财新网,2025-06-27 00:54:25.768,地缘图志：日本不接受美国汽车关税
财新网,2025-06-27 00:00:00.000,6月27日
财新网,2025-06-26 12:30:00.000,夜读深度：自动驾驶又添入局者
财新网,2025-06-26 09:20:00.000,热点数据：北京住宅新房销售面积微降
财新网,2025-06-26 08:31:23.554,数据推荐：白酒产量同比下降一成多
财新网,2025-06-26 07:10:00.000,稀土板块基本面能期待反转吗
财新网,2025-06-26 06:00:00.000,以伊停火后原油后市怎样演绎？
财新网,2025-06-26 04:00:00.000,香港金管局两年来首次买入港元
财新网,2025-06-26 02:50:00.000,存储芯片厂商“春风得意”
财新网,2025-06-26 01:30:00.000,数据发现：韩国房价终于止跌
财新网,2025-06-26 01:11:09.671,地缘图志：原油市场可能进入观望期
财新网,2025-06-26 00:00:00.000,6月26日
财新网,2025-06-25 12:30:00.000,夜读深度：出口禁令下的全球钴市场
财新网,2025-06-25 09:30:00.000,猪价反弹只是昙花一现？
财新网,2025-06-25 08:23:49.000,白酒的悲观情绪出尽了吗？
财新网,2025-06-25 07:15:00.000,美国6月消费者信心意外下降
财新网,2025-06-25 05:00:00.000,各国与特朗普磋商贸易协议进展如何？
财新网,2025-06-25 04:00:00.000,A股短期会大跌吗？
财新网,2025-06-25 02:40:00.000,高盛谈人形机器人板块的布局机会
财新网,2025-06-25 01:45:00.000,数据发现：马来西亚CPI
财新网,2025-06-25 00:33:27.372,地缘图志：亚洲对美出口激增
财新网,2025-06-25 00:09:28.701,6月25日
新浪财经,2025-06-24 16:43:00.000,曹操出行港股暗盘大跌13%，财务与市场双重困境凸显，过度依赖聚合平台
新浪财经,2025-06-24 16:29:00.000,汇添富稳安增聘甘信宇搭档杨靖，甘信宇连续3年正回报，杨靖3年0回撤
新浪财经,2025-06-24 16:08:00.000,斯坦德机器人港股IPO:两位哈工大毕业90后创立，薪酬差距拉大，王永锟年薪120万是李洪祥2倍！小米是核心股东
新浪财经,2025-06-24 14:53:00.000,深圳承泰科技冲刺港股：比亚迪贡献93.6%收入，且依赖性越来越大
财新网,2025-06-24 12:30:00.000,夜读深度：美团的几进几退
新浪财经,2025-06-24 11:47:00.000,A股大消费产业链支付账期大观——“地产”篇：房企平均账期为9个月 绿地控股常年“红档”账期超20个月
财新网,2025-06-24 09:20:00.000,超长债的“抢跑”行情
财新网,2025-06-24 08:30:00.000,以伊官宣停战，大宗商品价格作何反应？
财新网,2025-06-24 07:45:00.000,数据推荐：无烟煤价格继续探底
财新网,2025-06-24 07:00:00.000,鲍威尔准备解释为何不降息
财新网,2025-06-24 06:00:00.000,数据发现：甲醇价格自低位反弹
财新网,2025-06-24 03:57:14.000,美股一周前瞻：鲍威尔听证 5月PCE数据发布 
财新网,2025-06-24 03:00:00.000,数据发现：俄罗斯人的家庭债务
财新网,2025-06-24 01:35:32.354,地缘图志：比特币真能避险？
财新网,2025-06-24 00:09:07.059,6月24日
财新网,2025-06-23 12:30:00.000,夜读深度：阿里腾讯竞逐AI
财新网,2025-06-23 09:10:00.000,“酱油茅”如何重塑增长故事
财新网,2025-06-23 07:40:00.000,IMF总裁谈美国打击伊朗的经济风险
财新网,2025-06-23 06:35:00.000,数据推荐：实际使用外资同比降13.2%
财新网,2025-06-23 04:32:00.000,华尔街如何推演油价后续走势？
财新网,2025-06-23 03:30:00.000,热点数据：土地出让金收入同比降超过一成
财新网,2025-06-23 02:40:00.000,车企内卷下，中国人买车“便宜”了多少？
财新网,2025-06-23 01:40:00.000,数据推荐：5月英国零售转跌
财新网,2025-06-23 00:33:35.992,地缘图志：人民币全球支付水平被低估？
财新网,2025-06-22 23:56:30.594,6月23日
<<<<<<< Updated upstream,,
