来源,时间,标题
财联社,2025-09-01 08:11:31.000,暑运预计全社会跨区域人员流动119亿人次
财联社,2025-09-01 08:10:47.000,【九点特供】GPU独角兽再获增资近5亿元；阿里AI+云Capex投资高达386亿元，资本开支高增长有望驱动国产AI算力链迎基本面拐点，这家服务阿里的数据服务商已在国内建成35座数据中心
财联社,2025-09-01 08:08:08.000,以军内部文件显示“基甸战车”行动失败
财联社,2025-09-01 08:04:45.000,小鹏汽车：8月共交付智能电动汽车37709辆 同比增长169%
财联社,2025-09-01 07:55:37.000,全国近八成统筹区实现生育津贴直接发放至个人
财联社,2025-09-01 07:51:46.000,中指研究院：8月百城二手住宅价格延续回落态势，9月或迎政策密集期
财联社,2025-09-01 07:49:31.000,今日申购指南及新股定位分析
财联社,2025-09-01 07:48:48.000,去年广东省海洋生产总值突破2万亿元
财联社,2025-09-01 07:47:00.000,投资日历：周一资本市场大事提醒
财联社,2025-09-01 07:45:33.000,委防长：正为应对美国“任何行动”做准备
财联社,2025-09-01 07:44:43.000,黎议长拒绝支持美方提出的解除真主党武装计划
财联社,2025-09-01 07:43:54.000,【点金互动易】昇腾+液冷，产品批量用于包括昇腾在内的国产AI芯片，并可用于AI服务器液冷领域，这家公司正在推进电子产品散热部件应用
财联社,2025-09-01 07:42:53.000,高调宣布打死哈马斯高层 以媒却曝内部报告：失去全部国际信誉
财联社,2025-09-01 07:29:30.000,韩国2026财年预算总额创新高 AI成发力重点
财联社,2025-09-01 07:24:31.000,广发证券：各地供应趋紧 预计煤价下行有限
同花顺,2025-09-01 00:09:21.000,永清环保与灵伴科技达成战略合作
同花顺,2025-09-01 00:05:54.000,低通胀三部曲：居民重启加杠杆
同花顺,2025-09-01 00:05:33.000,"小鹏汽车：8月小鹏汽车共交付智能电动汽车37,709辆，同比增长169%"
同花顺,2025-09-01 00:02:15.000,日韩股市低开
同花顺,2025-09-01 00:00:52.000,以军内部文件显示“基甸战车”行动失败
同花顺,2025-09-01 00:00:27.000,安培龙：自研的氮氧传感器芯体已实现小批量交付
同花顺,2025-08-31 23:54:58.000,中信建投：长期趋势仍未改变，最优策略是切入低估值消费与周期板块
同花顺,2025-08-31 23:50:54.000,中指研究院：8月百城二手住宅价格延续回落态势，9月或迎政策密集期
同花顺,2025-08-31 23:50:23.000,美方计划控制加沙至少10年
同花顺,2025-08-31 23:42:04.000,委防长：正为应对美国“任何行动”做准备
同花顺,2025-08-31 23:36:21.000,华泰证券：9月产业催化密集下科技或仍有表现
同花顺,2025-08-31 23:24:13.000,阿里云：阿里采购寒武纪15万片GPU的消息不实
同花顺,2025-08-31 23:20:08.000,广发证券：各地供应趋紧，预计煤价下行有限，板块估值股息具备优势
同花顺,2025-08-31 23:19:29.000,券商二季度重仓股出炉 青睐基础化工、机械设备、汽车、医药生物等行业
同花顺,2025-08-31 23:12:39.000,也门胡塞武装称将对以军袭击发起报复
同花顺,2025-08-31 23:11:43.000,五家理财子公司实现净利与产品管理规模双增长
同花顺,2025-08-31 14:52:18.000,纪念活动新闻中心9月2日上午举办第三场记者见面会
同花顺,2025-08-31 14:39:00.000,2025年半年报落幕 上市券商中期分红预案基本出炉
同花顺,2025-08-31 14:37:03.000,招商局集团董事长缪建民调研钙钛矿新型半导体实验室
同花顺,2025-08-31 14:30:09.000,竞业达：截至7月底，AI+教学分析诊断报告业务在手订单已过千万
财新网,2025-08-29 16:53:31.664,夜读深度：亚欧贸易新走廊
财新网,2025-08-29 09:20:00.000,数据推荐：国企利润同比降幅扩大
财新网,2025-08-29 08:30:00.000,IMF二号人物对全球债市发出警告
财新网,2025-08-29 07:19:23.000,热点数据：中国对外直接投资同比降5.4%
财新网,2025-08-29 06:30:00.000,市场对人民币汇率弹性有点遐想
财新网,2025-08-29 05:25:00.000,今日市场热点
财新网,2025-08-29 04:00:00.000,一个引擎拉起恒瑞医药业绩
财新网,2025-08-29 02:20:00.000,英伟达投资者该不该落袋为安
财新网,2025-08-29 00:21:26.020,今日可关注
财新网,2025-08-29 00:20:26.058,个股方面
财新网,2025-08-29 00:19:45.301,2025年8月29日
财新网,2025-08-28 12:30:00.000,夜读深度：泰国产比亚迪卖向欧洲
财新网,2025-08-28 09:20:00.000,数据发现：澳大利亚失业率略回落
财新网,2025-08-28 08:30:00.000,牧原股份大手笔分红的逻辑
财新网,2025-08-28 07:20:00.000,港股能否“借西风”补涨？
财新网,2025-08-28 06:20:55.000,特朗普又开始怼索罗斯
财新网,2025-08-28 04:45:00.000,今日市场热点
财新网,2025-08-28 03:30:00.000,英伟达业绩“回到凡间”
财新网,2025-08-28 02:20:00.000,市场需要为美联储被干预定价吗
财新网,2025-08-28 00:48:36.061,今日可关注
财新网,2025-08-28 00:43:47.278,个股方面
财新网,2025-08-28 00:43:13.717,2025年8月28日
财新网,2025-08-27 10:00:00.000,美国地方联储行长明年可能花式被换？
财新网,2025-08-27 09:00:00.000,数据发现：入境旅行服务收入大增
财新网,2025-08-27 08:00:00.000,上海进一步放开限购，能否支撑楼市？
财新网,2025-08-27 06:40:00.000,股债同涨是昙花一现吗？
财新网,2025-08-27 05:10:00.000,今日市场热点
财新网,2025-08-27 04:20:00.000,债市回调接近尾声了吗
财新网,2025-08-27 03:30:00.000,缺爆款的爱奇艺怎么扭亏
财新网,2025-08-27 01:50:00.000,热点数据：前七月规上工业利润降幅略收窄
财新网,2025-08-27 00:09:45.684,今日可关注
财新网,2025-08-27 00:09:18.398,个股方面
财新网,2025-08-27 00:08:52.063,2025年8月27日
财新网,2025-08-26 12:30:00.000,夜读深度：有色金属龙头业绩得意马蹄劲
财新网,2025-08-26 09:10:00.000,热点数据：水泥出口大幅回升
财新网,2025-08-26 07:50:00.000,行情亮眼，散户真的跑步入场了吗？
财新网,2025-08-26 06:30:00.000,美韩元首会晤后签订航空大单
财新网,2025-08-26 05:30:00.000,美国对印度的50%高关税即将落地
财新网,2025-08-26 04:28:06.610,今日市场热点
财新网,2025-08-26 03:20:00.000,特朗普“开炮”威胁吊销两家新闻公司牌照
财新网,2025-08-26 02:00:00.000,美股一周前瞻：英伟达财报吸睛
财新网,2025-08-25 23:55:44.877,今日可关注
财新网,2025-08-25 23:55:10.770,个股方面
财新网,2025-08-25 23:53:57.549,2025年8月26日
财新网,2025-08-25 12:30:00.000,夜读深度：国补的“期中考”成绩
财新网,2025-08-25 09:40:00.000,报喜鸟走上安踏的道路
财新网,2025-08-25 08:20:00.000,创新药板块今年行情起飞背后
财新网,2025-08-25 07:30:00.000,从沃尔玛业绩看关税笼罩下的美国零售
财新网,2025-08-25 06:00:00.000,今日市场热点
财新网,2025-08-25 05:35:00.000,数据推荐：8月中旬LNG价格继续下探
财新网,2025-08-25 04:15:00.000,鲍威尔表态后的美债投资者们
财新网,2025-08-25 02:39:43.628,数据推荐：北京社零年内降幅扩大
财新网,2025-08-25 00:19:33.335,本周将有诸多数据发布
财新网,2025-08-25 00:19:21.166,个股方面
财新网,2025-08-25 00:19:07.927,2025年8月25日
